"title","url","price","image","description","vendor"
"Agir Floral Slip Dress","https://www.adoredvintage.com/products.json","148.00","https://cdn.shopify.com/s/files/1/1442/9764/files/Bluepinkfloral90sinspiredAgirmaxislipdressP451.jpg?v=1712603805","Romantic and feminine 90s inspired Agir maxi slip dress in a soft blush pink dotted with ditsy clusters of pink flowers. This vintage inspired dress would be so perfect for this summer's wedding season and features a v-neckline trimmed in pretty lace, light gathers at bust, and self sash at sides of waist to cinch in.Brand: AgirMeasurements: 52\" length / 18\" across chest (stretched) / 15\" across waist (stretched)Tagged Size: XS, Fits our size 35C/25/35H dress form as shownFabric: 100% PolyesterCondition: New - Tags Still Attached*All preloved items are FINAL SALE. Please shop mindfully and ask questions before purchasing. We are happy to help!\n","Preloved"
"Along the Riviera Set","https://www.adoredvintage.com/products.json","68.00","https://cdn.shopify.com/s/files/1/1442/9764/files/Feminine-vintage-inspired-navy-pink-striped-ribbon-tube-top-short-set-C2511L_1.jpg?v=1712364289","Charm in this vintage inspired pink and navy colored striped shorts and bandeau top lounge set. This cute set features a smocked elasticated bandeau top with cute knot detail you can take on and off to change the shape of the top and a pair of wide elasticated waistband shorts you slip on. Shorts have hidden side pockets. 100% Cotton / Set is unlinedHand Wash Cold / Line DryImported\nFit Notes & MeasurementsSize 4/6 dress form (35B/25W) is wearing a small as shownS: 13\" length / 26\"-28\" waist (shorts) | top fits 32\"-36\" bustM: 14\" length / 28\"-30\" waist (shorts) | top fits 34\"-38\" bustL: 15\" length / 30\"-32\" waist (shorts) | top fits 36\"-40\" bust","Modern"
"Forest Floor Skirt","https://www.adoredvintage.com/products.json","98.00","https://cdn.shopify.com/s/files/1/1442/9764/files/vintage-1990s-brown-leaf-print-button-down-midi-skirt-V159K_1.jpg?v=1715898218","Effortless and feminine vintage 1990s brown leaf print button down a-line midi skirt with defined front waist and elasticated back waist panel. Pair with your favorite lightweight knit cardigan or a classic white tee.Era: 1990'sFabric: RayonSizing: Best fits XS/SMeasurements: 30.5\" length / 12.5\" across waist (relaxed) Condition: Excellent vintage condition*All vintage & preloved items may show minor signs of wear. Anything significant will be noted & photographed. Please shop responsibly as all preloved/vintage items sales are final.","Vintage"
"Ramona Wrap Mini Skirt","https://www.adoredvintage.com/products.json","78.00","https://cdn.shopify.com/s/files/1/1442/9764/files/vintage-1990s-black-rust-floral-wrap-mini-skirt-V160K_1.jpg?v=1716243796","Flirty and feminine vintage 1990s black rust floral wrap mini skirt with side button closure. This mid thigh length floral mini skirt features a defined front waist and elasticated waist panel in back. Pair with your favorite knit cardigan or relaxed slightly cropped boxy tee and tennis shoes.Era: 1990'sFabric: RayonMeasurements: 18\" length / 12\" across waist (relaxed)Best fits size XS, Too small at waist for our size 4 dress form with 26\" waist, pinned in place to give idea of fitCondition: Excellent vintage condition*All vintage & preloved items may show minor signs of wear. Anything significant will be noted & photographed. Please shop responsibly as all preloved/vintage items sales are final.","Vintage"
"Morning Flutters Skirt","https://www.adoredvintage.com/products.json","98.00","https://cdn.shopify.com/s/files/1/1442/9764/files/antique-1910s-white-cotton-eyelet-petticoat-midi-skirt-V162K_1.jpg?v=1715898369","Romantic and feminine antique 1910s white cotton eyelet petticoat midi skirt perfect as a foundational garment or wear as a skirt with a slip underneath.Era: 1910'sFabric: CottonMeasurements: 31\" length / 12\" across waistBest fits size XS Condition: Excellent vintage condition / note small hole in fabric, slightly hidden by folds in fabric / Priced accordingly*All vintage & preloved items may show minor signs of wear. Anything significant will be noted & photographed. Please shop responsibly as all preloved/vintage items sales are final.","Vintage"
"Muscle Ease Oil","https://www.adoredvintage.com/products.json","16.00","https://cdn.shopify.com/s/files/1/1442/9764/files/Napiers-Muscle-Ease-Massage-Oil-L93A_1.jpg?v=1715904640","Revitalize your body and soothe tired muscles with Napier's invigorating massage blend, designed to ease everyday aches and pains. Crafted with a harmonious fusion of Cypress, Lemongrass, Lime, and Rosemary essential oils, this versatile blend offers a rejuvenating experience whether used for massage or added to your bath. Infused with Comfrey oil for its soothing properties, it's the perfect remedy for post-workout fatigue or whenever you've overexerted yourself. Formulated with a delicate and easily absorbed Sunflower carrier oil base, it ensures a nourishing experience that leaves your skin feeling replenished and renewed. 100mlMade in UK","Offerings"
"Bugbuster Outdoor Cream","https://www.adoredvintage.com/products.json","28.00","https://cdn.shopify.com/s/files/1/1442/9764/files/Napiers-Bugbuster-Outdoor-Skin-Cream-L92A_1.jpg?v=1716236203","Embrace the great outdoors without the annoyance of pesky insects with Bugbuster, our natural insect repellent cream enriched with the potent Highland Bog Myrtle extract. Formulated with a blend of citronella, eucalyptus, lavender, peppermint, chickweed, and jojoba oil, this gentle yet effective cream wards off biting insects like midges, making it ideal for outdoor enthusiasts seeking a chemical-free solution. Simply apply to exposed skin areas such as arms, legs, and neck to deter insect bites while enjoying its moisturizing and cooling effects. Perfect for dusk and evening outings when insects are most active, Bugbuster ensures uninterrupted outdoor adventures.100mlRecycled plastic jarMade in UKIngredients: Aqua, Vegetable Glycerin, Xanthan Gum, Aloe barbadensis (Aloe vera) oil, Cocos nucifera (Coconut) oil, Stellaria media (Chickweed) & prunus dulcis (Almond) oil, Sorbitan olivate, Cetearyl olivate, Glyceryl stearate, Cetearyl acohol, Simmondsia chinensis (Jojoba) oil, Tocopherol (Vitamin E), Benzyl alcohol, Salicylic acid, Sorbic acid, Cymbopogon nardus (Citronella grass) oil, Lavandula angustifolia (Lavender) oil, Mentha piperita (Peppermint) oil, Eucalyptus globulus oil, Myrica gale (Highland Bog Myrtle) extract, Eucalyptus. Naturally occurring in essential oils: Citral, Eugenol, Linalool, Citronellol, Farnesol, Limonene, Geraniol.","Offerings"
"Starflower Moisturizing Cream","https://www.adoredvintage.com/products.json","24.00","https://cdn.shopify.com/s/files/1/1442/9764/files/Napiers-Starflower-Dry-Skin-Cream-L91A_1.jpg?v=1715904595","Experience quick relief from dry, irritated, and itchy skin with the Starflower Moisturizing Cream. Formulated to moisturize and soothe, it offers cooling relief for hot, reddened, and irritated skin, making it a favorite among those with sensitive skin, including those prone to eczema and dermatitis. Perfect for professionals like hairdressers, mechanics, and nurses, it replenishes moisture lost to drying chemicals and constant hand washing. Rich in gamma-linoleic fatty acid (GLA), a vital nutrient for healthy skin, this vegan-friendly cream is now packaged in a glass jar with a recyclable plastic screw top lid. Embrace the natural healing power of Borage seed oil, packed with GLA to fortify skin cell walls and maintain moisture, leaving your skin nourished, hydrated, and resilient.100mlRecycled plastic jarMade in UKIngredients: Aqua, Cocos nucifera (Coconut), Prunus amygdalus dulcis (Sweet Almond), Borago officinalis (Starflower), Sorbitan olivate, cetearyl olivate, Stellaria media (Chickweed), Matricaria recutita (Chamomile) infused oil, Glyceryl stearate, Cetearyl alcohol, Glycerine, Benzyl alcohol, salicylic acid, glycerine, sorbic acid, Simmondsia chinensis (Jojoba), Xanthan gum, Vitamin E, Anthemis nobilis (Roman Chamomile), Matricaria recutita (German Chamomile).","Offerings"
"Age Defiance Cream","https://www.adoredvintage.com/products.json","28.00","https://cdn.shopify.com/s/files/1/1442/9764/files/Napiers-Age-Defiance-Corrective-Cream-L90A_1.jpg?v=1716235924","Unlock the secrets to radiant skin with Napiers' Age Defiance Corrective Cream, a powerhouse formula designed to combat visible signs of aging, including skin tags, age spots, and sun damage. Ideal for use on the face, neck, or hands, this cream boasts a luxurious blend of Shea and Cocoa butters, offering deep hydration without greasiness. Infused with Chamomile and Chickweed extracts, it calms and soothes the skin, leaving it feeling refreshed and rejuvenated. The uplifting scent of lemon essential oil tones and brightens the complexion, while rose geranium oil revitalizes maturing skin. Embrace the transformative power of nature with this Vegan-certified cream for a timeless glow.100 mlRecycled jarMade in UKIngredients: Aqua, Cocos nucifera, Sorbitan olivate, cetearyl olivate, Butyrospermum parkiii, Thuja occidentalis, Chelidonium majus, Stellaria media, Theobroma cacao, Matricaria recutita infused oil, Glyceryl stearate, Glycerine, Cetearyl alcohol, Linum usitatissimum, Benzyl alcohol, salicylic acid, sorbic acid, Xanthan gum, Vitamin E, Pelargonium Graveolens Flower Oil, Citrus limonium","Offerings"
"Monthly Magic Oil","https://www.adoredvintage.com/products.json","16.00","https://cdn.shopify.com/s/files/1/1442/9764/files/Napiers-Monthly-Magic-Massage-Oil-L87A_2.jpg?v=1715904425","Indulge in Napiers soothing Monthly Magic massage oil blend crafted to ease, calm, and support you through your menstrual cycle. Formulated with a delicate balance of Roman chamomile, Clary Sage, Geranium, and Sweet Marjoram essential oils, infused in a light grapeseed oil base, it offers gentle relief and relaxation when you need it most.100mlAmber glass bottleMade in UK","Offerings"
"Warming Muscle Cream","https://www.adoredvintage.com/products.json","28.00","https://cdn.shopify.com/s/files/1/1442/9764/files/Napiers-Capsicum-Ginger-Warming-Cream-L89A_3.jpg?v=1715904486","Unwind and soothe tired muscles and joints with Napier's Warming Cream, a comforting solution for aching backs, stiff muscles, and tense necks. This gentle yet effective cream provides warmth to your muscles and relief without causing any discomfort, making it perfect for daily use. With its pleasant and subtle scent, it creates a calming atmosphere as it eases creaky joints and stimulates circulation, especially in chilly conditions. Simply massage onto the affected areas to experience the revitalizing benefits. 100mlRecycled plastic jarMade in UKIngredients: Aqua, Prunus amygdalus dulcis, Symphytum officinale folia oleun, Arnic montana infused, Cetearyl olivate and sorbitan olivate, Cetearyl alcohol, Glyceryl stearate, Vegetable glycerine, Capsicum frutescens concentrate, Zingiber officinale roscoe concentrate, Piper nigrum seed oil, Melaleuca leucadendron cajuputi leaf oil, Origanum majorana leaf oil, Lavandula angustifolia, Juniperus communis fruit oil, Benzyl alcohol, salicylic acid, glycerine, sorbic acid, xantham gum, Vitamin E","Offerings"
"Skin Lightening Oil","https://www.adoredvintage.com/products.json","28.00","https://cdn.shopify.com/s/files/1/1442/9764/files/Napiers-Age-Defiance-Skin-Lightening-Oil-L88A_2.jpg?v=1715904474","Unveil youthful radiance with Napiers' Age Defiance Lightening Serum. Crafted to diminish visible signs of aging and age spots, this serum revitalizes your complexion with every application. Simply apply morning and evening to freshly cleansed skin, gently massaging into your face, neck, or hands for comprehensive rejuvenation. Turn back the hands of time and embrace a luminous, age-defying glow with Napiers' trusted formula.30mlGlass bottle & dropperMade in UKIngredients: Prunus persica kernel oil, Simmondsia Chinensis, Argania spinosa kernel oil, Caprylyl capryl glucoside & aqua & diisopropyl adipate & triethyl citrate, Matricaria recutita, Stellaria media infused oil, Equisetum Fluviatile Extract, Chelidonium Majus Extract, uja Occidentalis Leaf Extract, Glycyrrhiza Glabra Root Extract, Vitamin E, Benzyl alcohol, salicylic acid, glycerine, sorbic acid, Pelargonium graveolens, Citrus limonum.","Offerings"
"Ginger Anti Dandruff Shampoo","https://www.adoredvintage.com/products.json","24.00","https://cdn.shopify.com/s/files/1/1442/9764/files/Napiers-Ginger-and-Silver-Anti-Dandruff-Shampoo-L86A_2.jpg?v=1715904403","Crafted with precision, Napiers Ginger & Silver Shampoo harnesses the power of ginger root and colloidal silver extracts in a meticulously blended formula. Designed to nourish and soothe the scalp, this enriching shampoo supports follicle hydration, alleviating the discomfort of dandruff while enhancing hair condition. Experience the perfect blend for a healthier scalp and luscious locks.250mlPlastic bottle / metal capMade in UKIngredients: Aqua, Ammonium lauryl sulfate, Cocos nucifera, Vegetable glycerine, Zingiber officinalis extract, Benzyl alcohol, salicylic acid, glycerine, sorbic acid, Sodium chloride, Coco glucoside and glyceryl oleate, Organic Zingiber officinalis oil, Citrus aurantium bergamia, Caramel, CI 77820, Maltodextrin.","Offerings"
"Rosemary Shampoo","https://www.adoredvintage.com/products.json","24.00","https://cdn.shopify.com/s/files/1/1442/9764/files/Napiers-Herbstrong-Shampoo-Tonic-L85A_1.jpg?v=1715904391","Experience the magic of Napiers Rosemary Hair Tonic, crafted from Duncan Napier's 1860 formula. Made with care in Edinburgh, this shampoo promotes hair growth, soothes the scalp, and nourishes deeply. Enjoy its floral scent that takes you to a garden with every use. Try it today for a timeless beauty ritual.250mlPlastic BottleImported / Made in UK\nIngredients: Aqua, Ammonium lauryl sulfate, Vegetable glycerine, Sophora Flavescens Root Extract, Capsicum Annuum Fruit Extract, Lycium Chinense Fruit Extract, Camellia Sinensis Leaf Extract, Angelica Gigas Root Extract, Angelica Dahurica Root Extract, Rubus Coreanus Fruit Extract, Morus Alba Root Extract, Pinus Palustris Leaf Extract, Lithospermum Erythrorhizon Root Extract, Polygonum Multiflorum Root Extract, Coco glucoside and glyceryl oleate, Benzyl Alcohol, Salicylic Acid, Glycerine, Sorbic Acid, Sodium chloride, Caramel, Citrus medica Limonum, Citrus aurantifolia, Organic Rosmarinus officinalis","Offerings"
"Blank Canvas Dress","https://www.adoredvintage.com/products.json","58.00","https://cdn.shopify.com/s/files/1/1442/9764/files/Cream-linen-slip-on-oversize-short-sleeve-day-dress-C2547D_1.jpg?v=1715300621","Effortless and easy to wear, this loose cut oversized linen dress is perfect for those days when you want to be comfortable but put together and stylish. This boxy dress features a v-neckline and hidden side pockets. Wear with your favorite sandals and summer straw hat.80% Rayon, 20% LinenHand Wash Cold / Line DryImported\nFit Notes & MeasurementsSize 4 dress (34C/26W) is wearing a size small as shownS: 39\" length / best 34\"-36\" bust / open waist/hipsM: 40\" length / best 36\"-38\" bust / open waist/hipsL: 41\" length / best 38\"-40\" bust / open waist/hips","Modern"
"Along the Hudson Shorts - Tan","https://www.adoredvintage.com/products.json","58.00","https://cdn.shopify.com/s/files/1/1442/9764/files/Classic-feminine-vintage-inspired-khaki-mustard-high-waist-shorts-C2118R.jpg?v=1692195327","Easy linen blend high waist short with a vintage inspired silhouette. She comes in a lovely tani goldenrod colour and boasts smart front pleats, generous functional pockets, and an elastic waistband for comfort and ease. She's sure to become an effortless Summer staple with her timelessly feminine feel.30% Linen, 70% ViscoseHand Wash Cold / Line DryImported\nFit Notes & MeasurementsSize 4 dress (34C/26W) is wearing a size small as shownS: 16.5\" length / 26\"-28\" waist / 3.5\" inseamM: 17\" length / 28\"-30\" waist / 4\" inseamL:  17.5\" length / 30\"-32\" waist / 4.5\" inseam","Modern"
"Clay Studio Tee","https://www.adoredvintage.com/products.json","48.00","https://cdn.shopify.com/s/files/1/1442/9764/files/Classic-putty-tan-bamboo-modal-round-neck-tee-C2533T_1.jpg?v=1713915372","Effortless and easy to wear, this classic round neck short sleeve tee features single front pocket and is made in a super soft bamboo modal blend that feels cool and light on your skin.50% Bamboo, 42% Modal, 8% SpandexHand Wash Cold / Line DryImported\nFit Notes & MeasurementsSize 4 dress (34C/26W) is wearing a size small as shownS: 18.5\" length / 19\" across chest / 16.5\" shouldersM: 19\" length / 20\" across chest / 17\" shouldersL: 19.5\" length / 21\" across chest / 17.5\" shoulders","Modern"
"Along the Hudson Shorts - Navy","https://www.adoredvintage.com/products.json","58.00","https://cdn.shopify.com/s/files/1/1442/9764/files/Classic-feminine-vintage-inspired-navy-high-waist-shorts-C2117R.jpg?v=1692454483","<!--\ntd {border: 1px solid #cccccc;}br {mso-data-placement:same-cell;}\n-->Graced with a timelessly stylish vintage-inspired design, these midnight blue linen blend high-waisted shorts bring a touch of luxe to your summertime wardrobe. Glamorous pleated fronts, smart cuffed legs, generous functional pockets, and an elasticated waistband for comfort elevate this everyday essential.30% Linen, 70% ViscoseHand Wash Cold / Line DryImported\nFit Notes & MeasurementsSize 4 dress (34C/26W) is wearing a size small as shownS: 16.5\" length / 26\"-28\" waist / 3.5\" inseamM: 17\" length / 28\"-30\" waist / 4\" inseamL: 17.5\" length / 30\"-32\" waist / 4.5\" inseam","Modern"
"Lyrics Rehearsed Top","https://www.adoredvintage.com/products.json","48.00","https://cdn.shopify.com/s/files/1/1442/9764/files/Romantic-feminine-off-white-peasant-lace-up-back-peasant-top-C2552T_1.jpg?v=1715300725","Romantic and feminine vintage inspired vanilla cream lace up back peasant top featuring squared neckline, flutter sleeves, and smocked elasticated bodice.75% Rayon 25% Poly, Lining: 65% Cotton, 35% RayonHand Wash Cold / Line DryImported\nFit Notes & MeasurementsSize 4 dress (34C/26W) is wearing a size small as shownS: 15.5\" length / best 32\"-34\" bust max 36\"M: 16\" length / best 34\"-36\" bust max 38\"L: 16.5\" length / best 36\"-38\" bust max 40\"","Modern"
"Clouds in May Dress","https://www.adoredvintage.com/products.json","85.00","https://cdn.shopify.com/s/files/1/1442/9764/files/Effortless-romantic-blue-solid-elastic-waist-puff-sleeve-maxi-dress-C2556D_1.jpg?v=1715300813","Romantic and feminine vintage inspired ankle length dress in a soft slate blue color. This pretty dress features elasticated squared neckline, short puffed sleeves, and elasticated waist panel. The hemline is swingy and floaty and slightly longer on the sides, perfect for twirling or running across wildflower fields. Slips on for wear. Features hidden side pockets.80% Rayon, 20% Nylon / Fully linedHand Wash Cold / Line DryImported\nFit Notes & MeasurementsSize 4 dress (34C/26W) is wearing a size small as shownIf larger than a C cup and on latter end of bust measurement given, we recommend sizing upS: 52\" length / 34\"-36\" bust / 15.5\" bodice / 25\"-27\" waistM: 53\" length / 36\"-38\" bust / 16\" bodice / 27\"-29\" waistL: 54\" length / 38\"-40\" bust / 16.5\" bodice / 29\"-31\" waist","Modern"
"Garden at Eltham Dress","https://www.adoredvintage.com/products.json","85.00","https://cdn.shopify.com/s/files/1/1442/9764/files/Feminine-brown-cream-floral-print-elasticated-backless-maxi-dress-C2546D_1.jpg?v=1715300610","Romantic and feminine vintage inspired midi length sundress in a beautiful English country inspired heavy floral print of warm coco brown with soft pastels. This vintage inspired dress features a smocked gathered bodice, spaghetti straps, and open back design. Long flared skirt is ideal for making sweeping entrances.97% Cotton, 3% Poly/ Lining: 100% RayonHand Wash Cold / Line DryImported\nFit Notes & MeasurementsSize 4 dress (34C/26W) is wearing a size small as shownS: 46\" length (not inc straps) / 34\"-36\" bust / 15\"-19\" across waist (unlaced)M: 47\" length (not inc straps) / 36\"-38\" bust / 16\"-20\" across waist (unlaced)L: 48\" length (not inc straps) / 38\"-40\" bust / 17\"-21\" across waist (unlaced)","Modern"
"Pour Over Lounge Set","https://www.adoredvintage.com/products.json","58.00","https://cdn.shopify.com/s/files/1/1442/9764/files/Off-white-linen-blend-cami-shorts-lounge-set-C2550L_1.jpg?v=1715300692","Egg cream colored linen blend cami shorts lounge set perfect for warm summer days lounging at home or wear it out and about by the lake. Wear together or wear separately.80% Rayon, 20% LinenHand Wash Cold / Line DryImported\nFit Notes & MeasurementsSize 4 dress (34C/26W) is wearing a size small as shownLength of top does not include adjustable strapsS: 15\" length / 17\" across chest | 13.5\" length / 13\"-15\" across waistM: 16\" length / 18\" across chest | 14\" length / 14\"-16\" across waistL: 17\" length / 19\" across chest | 14.5\" length / 15\"-17\" across waist","Modern"
"Lilith Pointelle Top - Sky","https://www.adoredvintage.com/products.json","38.00","https://cdn.shopify.com/s/files/1/1442/9764/files/Feminine-vintage-inspired-blue-solid-rosette-pointelle-knit-tank-top-C2503T_1.jpg?v=1711666004","This dusky blue pointelle knit top will become a sweet little staple in your feminine vintage inspired wardrobe. This stretch knit top features a scoop neckline with a pretty little rosette detail at center.70% Viscose, 30% PolyesterHand Wash Cold / Line DryImported\nFit Notes & MeasurementsSize 4 dress (34C/26W) is wearing a size small as shownWe recommend sizing up to ensure pointelle knit isn't too see through (in photos you can see the size Small is a bit too stretched on our dress form)S: 21\" length / fits 32\"-34\" bustM: 22\" length / fits 34\"-36\" bustL: 23\" length / fits 36\"-38\" bust","Modern"
"Mauve Pigments Dress","https://www.adoredvintage.com/products.json","65.00","https://cdn.shopify.com/s/files/1/1442/9764/files/Vintage-inspired-taupe-tiered-midi-sundress-C2551D_1.jpg?v=1715300707","Feminine vintage inspired dusty rose pink tiered midi sundress featuring strapless silhouette, ruffled bodice, and tiered skirt. Perfect for summer BBQs and farmer's market runs. This vintage inspired dress is elasticated along the top bodice and waist and easily slips on for wear.100% RayonHand Wash Cold / Line DryImported\nFit Notes & MeasurementsSize 4 dress (34C/26W) is wearing a size small as shownS: 40\" length / best 32\"-34\" bust (max 36\") / 24\"-30\" waistM: 41\" length / best 34\"-36\" bust (max 38\") / 26\"-32\" waistL: 42\" length / best 36\"-38\" bust (max 38\") / 28\"-34\" waist","Modern"
"Dakota Top","https://www.adoredvintage.com/products.json","46.00","https://cdn.shopify.com/s/files/1/1442/9764/files/Dolman-sleeve-cotton-drawstring-waist-semi-crop-top-C2548T_1.jpg?v=1715300654","Easy and effortless, this 80s inspired dolman sleeve cotton drawstring waist semi crop top is perfect with your favorite trousers, shorts, or jeans. 100% CottonHand Wash Cold / Line DryImported\nFit Notes & MeasurementsSize 4 dress (34C/26W) is wearing a size small as shownS: 17.5\" length / best 32\"-34\" bust (max 36\")M: 18.5\" length / best 34\"-36\" bust (max 38\")L: 19.5\" length / best 36\"-38\" bust (max 40\")","Modern"
"Goodfair \"Recycled\" Crewneck Sweatshirt","https://goodfair.com/products.json","35.00","https://cdn.shopify.com/s/files/1/0077/1745/3881/files/7_0e9790b1-fd00-44a9-aa77-be5782e6902d.png?v=1712256062","Discover the charm of sustainable fashion with Goodfair's \"Recycled\" crewneck sweatshirt. Proudly bearing the word \"Recycled\" to signify your commitment to eco-friendly practices, each sweatshirt is a testament to unique style and environmental responsibility. Crafted from pre-loved materials, these sweatshirts come in an array of colors, chosen at random, ensuring that each piece is as unique as its wearer. While small stains and blemishes tell the story of its past life, they add to the authenticity and charm of your garment. By choosing this sweatshirt, you're not just making a style statement; you're advocating for a greener planet and supporting sustainable living. Embrace the unpredictability and make a positive impact with this distinctive crewneck.","Goodfair"
"Goodfair Treehugger Crewneck Sweatshirt","https://goodfair.com/products.json","35.00","https://cdn.shopify.com/s/files/1/0077/1745/3881/files/5_ffcb5a34-cf59-407b-816f-007f96e80bb6.png?v=1712255914","Embrace sustainable fashion with Goodfair's second-hand \"Treehugger\" crewneck sweatshirt. Each piece, unique with its own story, proudly displays the word \"Treehugger\" across the front, making a bold statement about your commitment to the environment. Crafted from cozy materials, these sweatshirts are carefully selected for their quality and character, including small stains and blemishes that add to their authenticity and charm. By choosing this eco-friendly option, you're not just making a fashion statement; you're supporting a cycle of sustainability and contributing to a greener planet. Join the movement towards a more sustainable future with this distinctive and meaningful sweatshirt. No predictability on color. ","Goodfair"
