"title","url","price","image","description","vendor"
"Hatter Dot","https://www.goodeeworld.com/products.json","592.00","https://cdn.shopify.com/s/files/1/0071/1684/9252/files/HATTER_dots_noisette_1.jpg?v=1716321037","Whether adorning dining rooms, hallways, or cozy breakfast nooks, the Hatter Dot by Golden Editions effortlessly infuses visual warmth while making a design statement. Handcrafted in Bolgatanga, Ghana, using locally harvested Veta Vera grass hand-dyed with natural pigments, each lamp takes two days to weave — a true testament to the mastery of Bolgatanga’s artisans. Finished elegantly with brass accents and equipped with an electrical cord, this lamp truly comes alive at night when its delicate, open-weave design casts mesmerizing light patterns, transforming any space into a captivating celebration of basket-weaving artistry.","Golden Editions"
"Lantern Wall Lamp","https://www.goodeeworld.com/products.json","383.00","https://cdn.shopify.com/s/files/1/0071/1684/9252/files/Lantern-Natural-Ginger-flip.jpg?v=1715091041","Could your space use a little more textural beauty and warmth? The Lantern Wall Lamp by Golden Editions delivers just that with its natural weave and soft light patterns, creating a warm, inviting ambiance whether illuminated or not. Artfully crafted using traditional basket weaving techniques from Bolgatanga, northern Ghana, this eye-catching piece is made from durable Veta Vera grass and elegantly finished with satin brass fixtures (electrical cord included). Perfect for adding a cozy touch to living rooms, hallways, or bedrooms while supporting artisanal craftsmanship.","Golden Editions"
"Goodee Hoodie x Clementine Dufaut","https://www.goodeeworld.com/products.json","161.00","https://cdn.shopify.com/s/files/1/0071/1684/9252/files/GOODEE_HoodiexClementineDufault.jpg?v=1715378852","Spread a message of hope and optimism each time you wear this special edition of our much-loved Goodee Hoodie. Crafted from 100% GOTS-certified organic cotton, this unique gender-neutral staple offers a generous fit for instant comfort. Every detail — down to the contrasting hood cord made with recycled materials — is mindfully designed to elevate your everyday in the most sustainable way possible. The striking bird illustration on the back, designed by Montreal artist Clémentine Dufaut in her signature tattooing style, symbolizes freedom and movement, adding an extra layer of meaningful expression to your outfits.","Goodee"
"White Bird Woven Blanket","https://www.goodeeworld.com/products.json","369.00","https://cdn.shopify.com/s/files/1/0071/1684/9252/files/024050540012.jpg?v=1715377998","Movie nights, picnics in the park, and relaxing summer evenings — now made even better with an extra touch of comfort and style. Beautifully handwoven in the USA from 100% cotton, the Clémentine Dufaut blanket transcends its purpose. This limited-edition piece celebrates the fusion of traditional craftsmanship and contemporary design with a captivating bird illustration by the Montreal artist that seamlessly blends analog and digital artistry. Adding to its allure, a soft fringed edge prevents fraying and ensures its longevity. More than a blanket, this is a timeless work of art you'll cherish for years to come.","Clementine Dufaut"
"CH24 | Children's Wishbone Chair","https://www.goodeeworld.com/products.json","1176.00","https://cdn.shopify.com/s/files/1/0071/1684/9252/files/CH24Child_CH24_oak_oil_natural_papercord.jpg?v=1715379104","In celebration of Hans J. Wegner’s 110th birthday, the iconic 1949 Wishbone Chair has been reimagined for children. This complex, sculptural chair has been carefully scaled down by Carl Hansen & Søn to achieve the exacting proportions of the original in solid oak and woven paper cord. The result is equally as timeless as elegant and a beautiful addition to a bedroom or playroom, suitable for age 3+.","Carl Hansen & Son"
"Semi Circle Coconut Doormat","https://www.goodeeworld.com/products.json","63.00","https://cdn.shopify.com/s/files/1/0071/1684/9252/files/455505_20216-V2.jpg?v=1715267518","When it comes to doormats, coconut fiber (or coir) is the gold standard as it effortlessly scrapes shoes clean and promises many years of good service. Expertly hand-crafted in Sri Lanka, this eye-catching Redecker number will add an elevated look to any entryway and trap dirt before it reaches your floors thanks to its heavy-duty bristles. Suitable for all weather conditions (including frosty winters), this is the ideal pick for mudrooms, patios, and outdoor entryways.","Redecker"
"Oak Handle Hand Brush","https://www.goodeeworld.com/products.json","77.00","https://cdn.shopify.com/s/files/1/0071/1684/9252/files/Goodee-Redecker-OakHandleHandBrush.jpg?v=1715178848","Complete your plastic-free cleaning arsenal with the Oak Handle Hand Brush from Redecker. Expertly crafted in Germany from oil-treated, oak wood, ash wood, and dark-stained split horsehair, this hand brush combines sustainability with style. Its ergonomic design and sturdy construction make it ideal for everyday sweeping tasks, while its biodegradable materials ensure minimal environmental impact. Pair it with Redecker's Oak Handle Dust Pan for a comprehensive cleaning solution that's as functional as it is beautiful.","Redecker"
"Oak Handle Dust Pan","https://www.goodeeworld.com/products.json","56.00","https://cdn.shopify.com/s/files/1/0071/1684/9252/files/Goodee-Redecker-OakHandleDustPan.jpg?v=1715179529","Make a sustainable switch from plastic with the Oak Handle Dust Pan from Redecker. Crafted in Germany from oil-treated, black oak wood and powder-coated metal, this dustpan is as sturdy as it is stylish. Its ergonomic design ensures comfortable handling while sweeping up debris, and its durable construction promises years of faithful service. Match it with Redecker's Oak Handle Hand Brush for a complete cleaning set that's both eco-friendly and effective.","Redecker"
"Lint Broom with Broomstick","https://www.goodeeworld.com/products.json","126.00","https://cdn.shopify.com/s/files/1/0071/1684/9252/files/Goodee-Redecker-LintBroomwithBroomstick.jpg?v=1715178667","Say goodbye to pesky pet hair and stubborn lint with the Lint Broom with Broomstick by Redecker. Designed for quick and efficient cleanup, this broom features a hand-mounted rubber head that generates a static charge when rubbed, attracting hair, lint, and dust like a magnet. Whether it's pet hair on carpets or dust bunnies in corners, this broom makes light work of any cleanup task. Handcrafted in Germany frombeechwood and rubber, it comes with a sturdy wooden broomstick for easy handling.","Redecker"
"Scallop Dessert Plate","https://www.goodeeworld.com/products.json","81.00","https://cdn.shopify.com/s/files/1/0071/1684/9252/products/GOODEE_22_Malaika_Shashiko_Linen_Placemats_and_Tablecloths_-_GROUP_1071.jpg?v=1697220754","Looking for festive dessert plates for the holiday season and beyond? This scalloped number by Malaika is a beautiful option with its soothing turquoise color and unique design. Carefully hand-crafted by master potter Mohamed Mahmoud in Egypt’s Fayoum oasis using traditional techniques and fire clay from Aswan, it’ll also make for a sweet conversation piece at the dinner table. The perfect backdrop for all your sweet treats and delicious puddings.\nFayoum pottery is entirely hand-crafted so each item is unique, with slight variations in color, size, and finish.\n","Malaika"
"Apothecary Hand Wash Refill","https://www.goodeeworld.com/products.json","63.00","https://cdn.shopify.com/s/files/1/0071/1684/9252/files/2737_06479f5f94-frama-st-pauls-apothecary-color-context-image-32-original_1200x_2c6bbd20-e969-47f6-868d-5ba9dd5f5f2b.jpg?v=1697124515","When it’s time to replenish your bottle of Apothecary Hand Wash (or your own hand soap dispenser), Frama’s Apothecary Hand Wash Refill is just what you need. With a gentle formula that leaves the skin soft, nourished, and delicately scented with notes of sandalwood, cedarwood, and ylang ylang, this mineral-rich cleansing gel crafted from natural ingredients is packaged in recycled PET for minimal environmental impact.","Frama"
"Shetland Throw","https://www.goodeeworld.com/products.json","272.00","https://cdn.shopify.com/s/files/1/0071/1684/9252/files/SHETLAND-THROW-SN-2.000903.jpg?v=1697550468","You can never go wrong with a plaid throw blanket, especially when it's the sumptuous Ezcaray Shetland Throw. Expertly hand-woven from sustainably sourced Shetland wool and beautifully finished with a fringe, this classic piece promises a lifetime of warmth and elegance. It’s the perfect addition to infuse your space with a cozy mountain feel, equally suited to snuggling up by the campfire or staying toasty on your summer adventures.","Ezcaray"
"Picasso Throw","https://www.goodeeworld.com/products.json","341.00","https://cdn.shopify.com/s/files/1/0071/1684/9252/files/PICASSO-THROW-PS-51.000856.jpg?v=1704403118","Aptly named the Picasso, the unique circles prevalent in this handcrafted throw call to mind the geometric shapes featured in the iconic artist's body of work. Made with care and intention by Ezcaray's artisans, nearly every step of its production is executed by hand—from washing and brushing the premium wool threads, to dying and weaving them into this exquisite pattern.Surpassing time and trend, the Picasso feels classic and contemporary at once, a lovely, warm and welcoming addition to your living space.","Ezcaray"
"Picasso Cushion Cover","https://www.goodeeworld.com/products.json","133.00","https://cdn.shopify.com/s/files/1/0071/1684/9252/files/PICASSO-CUSH-PS-47.000119.jpg?v=1696966415","If you're looking to cozy up your space, the Picasso Cushion Cover by Ezcaray is your answer. Crafted with care from a sustainable blend of Merino and mohair wool, this cover exudes warmth and comfort with its rich palette and inviting texture. Complete the look by adding a separate cushion inner and place it on your favorite armchair or layer it with complementary cushions on your sofa for a snug setup.","Ezcaray"
"Cuadros Throw","https://www.goodeeworld.com/products.json","453.00","https://cdn.shopify.com/s/files/1/0071/1684/9252/products/cuadros-throw-4005_5429.jpg?v=1701985490","Whether lounging on the sofa or cuddling up in bed with extra layers, here's a throw you'll love wrapping yourself in. Lovingly crafted in a rich mohair wool blend using traditional looming methods, the Cuadros by Ezcaray is incredibly durable and deliciously soft to the touch, with a timeless checkered pattern that'll spruce up the room in no time. It is so delightful, in fact, that you'll never want to spend an evening without it again.","Ezcaray"
"Goodee x Graf Lantz Market Tote - Our Gift to You!","https://www.goodeeworld.com/products.json","28.00","https://cdn.shopify.com/s/files/1/0071/1684/9252/files/NB052423-63.jpg?v=1686774937","The Ami Cotton Market Tote designed in collaboration with Graf Lantz is the perfect accessory for everything and everyday. Made from 100% cotton netting, the tote collapses into its own pouch for easy storage from treasured market finds to beach days and everything in between.","Goodee x Graf Lantz"
"Bolgatanga Set of Three (Small)","https://www.goodeeworld.com/products.json","4029.00","https://cdn.shopify.com/s/files/1/0071/1684/9252/files/20220104_Bolgatanga-small-Set-of-3.jpg?v=1707151273","Introducing Pakurigo waves—a unique weaving technique by Baba Tree's master weavers in Ghana. The Bolgatanga lamps combines Pakurigo waves with repurposed PET plastic bottles. With over 250 artisans, Baba Tree merges Gurunsi weaving traditions with modern aesthetics. Every lamp crafted is a testament to their individual artistry and creativity, as they infuse their culture into each piece.Please contact care@goodeeworld.com to review your set combination options with one of our design representatives. The images featured are for inspiration only. Please note that as this product is made to order, it is not eligible for returns.\n","PET Lamp"
"Model 1081 Floor Lamp","https://www.goodeeworld.com/products.json","3862.00","https://cdn.shopify.com/s/files/1/0071/1684/9252/files/M1081_astep_23_7438.jpg?v=1713277097","Model 1081 Floor, designed by Gino Sarfatti, is a case study in balance. The strong visual presence of the floor light is a case study in balance. A single luminous sphere rests delicately on the black finish steel stem and base, serving as an ornamental structure. Alone the lamp stands as a solitary sculpture, in pairs a composition emitting a warm and diffused light. The floor lamp comes in two heights, 66 in and 71 in.","Astep"
"VV Cinquanta Floor Lamp","https://www.goodeeworld.com/products.json","2721.00","https://cdn.shopify.com/s/files/1/0071/1684/9252/files/VV_Cinquanta_Floor_Black_Frame_Black_Reflector_300dpi.jpg?v=1713276954","Designed by Italian architect Vittoriano Viganó, the VV Cinquanta features an elegant and versatile posable direct light source that can swivel and tilt, from direct working light to upward lighting. The VV Cinquanta Floor model stands gracefully on a slender black aluminium frame. The VV Cinquanta reflector is made of enameled spun aluminium, available in original Vittoriano Viganò colors.","Astep"
"Model 537 Table Lamp","https://www.goodeeworld.com/products.json","2401.00","https://cdn.shopify.com/s/files/1/0071/1684/9252/files/Astep_0219_FwS_Model_537_300dpi.jpg?v=1713276854","In its refined simplicity, the Model 537 table lamp stands out owing to the combination of rich materials and ingenious, playful design. The large aluminium reflector in black or white is mounted asymmetrically on a lacquered or brushed brass stem, which is carefully twisted in a beautiful balancing act, coming to rest on an elegant marble base. As a vital part of the design, the stem reaches out through the reflector and beyond in a backward motion, giving the top of the stem a dual function as playful feature and practical handle.","Astep"
"Model 2065 Pendant","https://www.goodeeworld.com/products.json","3048.00","https://cdn.shopify.com/s/files/1/0071/1684/9252/files/Model_2065_White_Diffuser_Black_Hardware_Black_Cable_300dpi.jpg?v=1713277053","The Model 2065 is made of two joined opaline methacrylate saucer-shaped diffusers, suspended from a black painted aluminium ceiling canopy. The simplicity of the design and lightness of the materials makes for an elegant and free-floating luminaire. The newest version adds to these features in terms of sustainability: the diffusers are made of Green Cast®, a 100% recycled and recyclable PMMA (polymethyl methacrylate) — patented and made in Italy — that has exactly the same aesthetic and functional quality of original methacrylate.","Astep"
"Tradition End Module","https://www.goodeeworld.com/products.json","5100.00","https://cdn.shopify.com/s/files/1/0071/1684/9252/files/FH_Tradition_LightSand_Setting_2_B.jpg?v=1713198615","Tradition is a modular lounge series in teak that brings refined sophistication to outdoor spaces. With the versatility to fit any lounging style preference, Tradition’s elegance and comfort are an invitation to unwind. Designed for Fritz Hansen by Danish architect and designer Povl B. Eskildsen.The Tradition End Module rounds off the outdoor lounge set with a generous extra seat. Crafted in the same high-quality materials and dedication to details, the spindle backrest wraps around on two sides and can be secured together to create a seamless and stable lounge experience.","Skagerak by Fritz Hansen"
"Tradition Spacer Module","https://www.goodeeworld.com/products.json","4700.00","https://cdn.shopify.com/s/files/1/0071/1684/9252/files/FH_Tradition_LightSand_Setting_7.jpg?v=1713360591","Tradition is a modular lounge series in teak that brings refined sophistication to outdoor spaces. With the versatility to fit any lounging style preference, Tradition’s elegance and comfort are an invitation to unwind. Designed for Fritz Hansen by Danish architect and designer Povl B. Eskildsen. The spacer module for Tradition extends the outdoor lounge set with a generous extra seat. Crafted in the same high-quality materials and dedication to details, the spindle backrest sits perfectly with all other Tradition pieces and can be secured together to create a seamless and stable lounge experience.","Skagerak by Fritz Hansen"
"Tradition Pouf","https://www.goodeeworld.com/products.json","2900.00","https://cdn.shopify.com/s/files/1/0071/1684/9252/files/FH_Tradition_Pouf_Light_Sand.jpg?v=1713196002","Tradition is a modular lounge series in teak that brings refined sophistication to outdoor spaces. With the versatility to fit any lounging style preference, Tradition’s elegance and comfort are an invitation to unwind. Designed for Fritz Hansen by Danish architect and designer Povl B. Eskildsen. The Tradition Pouf brings an extra element of comfort to stretch out and unwind or use an extra seat for social occasions.","Skagerak by Fritz Hansen"
"Tradition Lounge Chair","https://www.goodeeworld.com/products.json","5700.00","https://cdn.shopify.com/s/files/1/0071/1684/9252/files/FH_Tradition_LightSand_Lounge_Chair.jpg?v=1713198594","Tradition is a modular lounge series in teak that brings refined sophistication to outdoor spaces. With the versatility to fit any lounging style preference, Tradition’s elegance and comfort are an invitation to unwind. Designed for Fritz Hansen by Danish architect and designer Povl B. Eskildsen.The Tradition Lounge Chair adds an extra social element to the Tradition Lounge set or can equally stand alone as an exceptionally comfortable outdoor lounge chair. Crafted in the same high-quality materials and dedication to details, the spindle backrest and arms wrap around to create an inviting space for outdoor relaxation.","Skagerak by Fritz Hansen"
"Tradition Corner Module","https://www.goodeeworld.com/products.json","5700.00","https://cdn.shopify.com/s/files/1/0071/1684/9252/files/FH_Tradition_Corner_Module_Light_Sand.jpg?v=1713195807","Tradition is a modular lounge series in teak that brings refined sophistication to outdoor spaces. With the versatility to fit any lounging style preference, Tradition’s elegance and comfort are an invitation to unwind. Designed for Fritz Hansen by Danish architect and designer Povl B. Eskildsen.The Tradition Corner Module extends the outdoor lounge set with a generous and comfortable cushioned corner seat. Crafted in the same high-quality materials and dedication to details, the spindle backrest wraps around on two sides and can be securely connected to create a seamless and stable lounge experience.","Skagerak by Fritz Hansen"
"Tradition Lounge Table","https://www.goodeeworld.com/products.json","1800.00","https://cdn.shopify.com/s/files/1/0071/1684/9252/files/FH_Tradition_LightSand_Setting_1_H.jpg?v=1713205369","Tradition is a modular lounge series in teak that brings refined sophistication to outdoor spaces. With the versatility to fit any lounging style preference, Tradition’s elegance and comfort are an invitation to unwind. Designed for Fritz Hansen by Danish architect and designer Povl B. Eskildsen.The Tradition Table adds a practical place for glasses, sunblock, books, or lanterns. It can fit seamlessly between Tradition’s seat modules, extending the lounge with a functional and beautifully crafted teak table. It also works perfectly as a stand-alone piece.","Skagerak by Fritz Hansen"
"Spine Bar/Counter Stool with Back - Wood Base","https://www.goodeeworld.com/products.json","2965.00","https://cdn.shopify.com/s/files/1/0071/1684/9252/files/2019_10_10_FF55081_1731.jpg?v=1711564488","Looking for a comfortable seating option for a kitchen island or bar area? The Fredericia Spine Bar/Counter Stool is your answer. Meticulously crafted with attention to materials, its blend of classic and innovative design elements ensures a dynamic look that complements any space, especially in open-concept homes. And with its comfortable straight seat, it seamlessly combines the comfort of a dining chair with the social allure of a barstool. Perfect for unwinding with a glass of your favorite drink after a long day.","Fredericia"
"Spine Chair","https://www.goodeeworld.com/products.json","2756.00","https://cdn.shopify.com/s/files/1/0071/1684/9252/files/2019_10_10_FF55106_1721.jpg?v=1711554331","Whether you're curating the ambiance of a chic eatery or cultivating a cozy lounge space at home, the Spine chair by Fredericia is a perfect choice. Crafted with the discerning diner or relaxation seeker in mind, it embodies both professional sophistication and laid-back comfort. With its casual yet elegant design showcasing open sides and subtle upholstery details, this chair invites you to unwind in style.","Fredericia"
"Set of 3 Birds","https://www.goodeeworld.com/products.json","126.00","https://cdn.shopify.com/s/files/1/0071/1684/9252/files/SE0563372.0342.jpg?v=1712172756","Looking for the perfect finishing touch to complete your shelf decor? Turn to this charming set of three birds from the Tunisian brand Tinja, and picture these little messengers of peace, each grasping an olive branch, as they peer out towards new beginnings. Crafted with skill by the dedicated women artisans of Sejnane, using techniques handed down through generations, these birds come in a family set of three sizes, echoing centuries of artistic heritage. Let these serene creatures, each with its own character, bring a piece of the Mediterranean to your interior.","tinja"
"Granmere's Advice Blouse","https://www.adoredvintage.com/products.json","98.00","https://cdn.shopify.com/s/files/1/1442/9764/files/vintage-1950s-cream-sheer-floral-neckline-pleat-blouse-V153T_1.jpg?v=1716236996","Feminine and elegant vintage 1950s cream sheer short sleeve blouse with pretty floral lace applique along the neckline and pleats all along the front bodice. Buttons up along the back.Era: 1950'sFabric: Feels like nylon blendMeasurements: 48\" length / 18\" across chest (relaxed) / 15\" across waist (untied)Best fits size SmallCondition: Excellent vintage condition*All vintage & preloved items may show minor signs of wear. Anything significant will be noted & photographed. Please shop responsibly as all preloved/vintage items sales are final.","Vintage"
"A Classic Rendered Dress","https://www.adoredvintage.com/products.json","85.00","https://cdn.shopify.com/s/files/1/1442/9764/files/Romantic-vintage-inspired-natural-solid-linen-puff-sleeve-midi-dress-C2555D_1.jpg?v=1715300789","Timeless and feminine romantic vintage inspired natural solid linen puff sleeve midi dress with softly squared neckline, soft a-line skirt, and smocked elasticated panel in back.<!--td {border: 1px solid #cccccc;}br {mso-data-placement:same-cell;}-->55% Linen, 45% Rayon\nHand Wash Cold / Line DryImported\nFit Notes & MeasurementsSize 4 dress (34C/26W) is wearing a size small as shownS: 47\" length / 34\" bust / 26\" waist / 14.5\" bodice lengthM: 48\" length / 36\" bust / 28\" waist / 15\" bodice lengthL: 49\" length / 38\" bust / 30\" waist / 15.5\" bodice length","Modern"
"Autumn Floristry Dress","https://www.adoredvintage.com/products.json","148.00","https://cdn.shopify.com/s/files/1/1442/9764/files/vintage1970sbrownmarronfloralprintbohopeasantmididressV146D1.jpg?v=1712604390","Perfect for the woman whom Autumn eternally lives in her heart, this vintage 1970s brown floral print boho peasant midi dress features a heavy floral print of dusky coral, pink, cream, and ruddy brown. This vintage 70s dress features notched round neckline, puffed peasant sleeves, a-line silhouette, and flounce ruffle hem. Era: 1970'sFabric: Feels like PolyesterMeasurements: 39.5\" length / 16\" across chest (relaxed) / open waist / 13\" shouldersSizing: Best fits XS/S (will fit slightly oversize)Condition: Great vintage condition / some small runs in fabric on sleeves*All vintage & preloved items may show minor signs of wear. Anything significant will be noted & photographed. Please shop responsibly as all preloved/vintage items sales are final.","Vintage"
"Mantigue Straw Bag","https://www.adoredvintage.com/products.json","98.00","https://cdn.shopify.com/s/files/1/1442/9764/files/VintageinspiredbrownwovenstrawsisalbagwithleatherhandlesA541B1.jpg?v=1715202765","Vintage inspired brown natural woven straw sisal bag with leather handles. Effortlessly chic and beautifully made, this bag is a timeless addition to any wardrobe. The sturdy leather handles give it a classic touch while the natural woven straw material brings texture and charm. Tie your favorite cotton bandana on the handles for a pop of color and texture.Straw / Leather\nMeasurements: 14.5\" across top (widest point) / 9.5\" tall / 5.5\" depth / 8.5\" handle dropImported","Modern"
"Louise Knit Top","https://www.adoredvintage.com/products.json","58.00","https://cdn.shopify.com/s/files/1/1442/9764/files/Feminine-vintage-inspired-fitted-off-white-ribbed-button-down-top-C2532W_1.jpg?v=1714082813","Feminine vintage inspired fitted off white button down knit top with soft and subtle ribbing. This lightweight knit cardigan top can be worn as a layering piece or on it's own. Material is semi sheer so a skin toned undergarment will need to be worn if wearing on it's own as a top.89% Viscose, 11% NylonHand Wash Cold / Line DryImported\nFit Notes & MeasurementsSize 4/6 dress form (36B/25.5W) is wearing a small as shownS: 21\" length / best fits 34\"-36\" bust / 24\" sleevesM: 22\" length / best fits 36\"-38\" bust / 25\" sleevesL: 23\" length / best fits 38\"-40\" bust / 26\" sleeves","Modern"
