"title","url","price","image","description","vendor"
"100 Lb Bale Cotton Tshirt + Polo Distressed (Pickup Only)","https://goodfair.com/products.json","65.00","https://cdn.shopify.com/s/files/1/0077/1745/3881/files/IMG_3551.jpg?v=1710424290","Dive into Goodfair's 100 Lb bale of distressed T-shirts and polos. With just a hint of brand names and vintage pieces amidst a sea of wear and tear, each item is a gamble, ripe for transformation. These clothes require cleaning and potential mending, offering a canvas for creativity. Available for pickup at our Houston warehouse, they beckon the bold and imaginative.","Goodfair"
"100 Lb Bale: Distressed Jeans (PICKUP ONLY)","https://goodfair.com/products.json","80.00","https://cdn.shopify.com/s/files/1/0077/1745/3881/files/IMG_3412.jpg?v=1710423634","Dive into Goodfair's 100 Lb bale of #3 grade Distressed Jeans, a treasure trove of ripped, torn varieties across brands and sizes. Embrace the unpredictability and creativity; perfect for cutting up or upcycling. Each piece, with its stains and stories, awaits at our Houston warehouse—pickup only. Transform and reimagine!","Goodfair"
"Preloved Quilt Blanket: Set of 2","https://goodfair.com/products.json","50.00","https://cdn.shopify.com/s/files/1/0077/1745/3881/files/Quilt4.png?v=1702762445","Get ready to snuggle up in style with Goodfair's Preloved Quilted Blanket Set! This duo is not your average blanket set – it's a totally cool, eco-friendly statement. Each quilt is a one-of-a-kind masterpiece, made from upcycled fabrics, which means you're doing your bit for the planet while chilling in style. Imagine the coolest mix of colors and patterns that scream unique – that's what you get with these quilts. They're big enough for those movie marathons and just right for adding a splash of awesome to your room. Perfect for anyone who loves to stand out and cares about the Earth. With these blankets, you're not just keeping warm; you're rocking sustainability like a boss! 🌎💚🛌","Goodfair"
"Goodfair Branded Pre - Loved Flannel Shirt","https://goodfair.com/products.json","25.00","https://cdn.shopify.com/s/files/1/0077/1745/3881/files/Screenshot2023-11-29at9.50.08AM.png?v=1701273501","Eco-Friendly Fashion with a Signature Touch Experience sustainable style like never before with Goodfair's Mystery Second-Hand Flannels, each adorned with our famous Goodfair logo on the pocket. This unique detail sets our flannels apart, symbolizing your commitment to eco-conscious fashion.Curated for Quality and Style Our expert team hand-selects each flannel, ensuring a blend of quality, comfort, and vintage charm. Embrace the surprise as we pick a special piece just for you, from classic checks to unique patterns.Sustainable and Stylish By choosing our second-hand flannels, you're making an environmentally friendly choice and reducing fashion waste. Each piece is not just clothing; it's a story woven into fabric.Versatile for Every Occasion Ideal for any casual setting, these flannels pair perfectly with jeans or over a T-shirt. Embrace comfort and style in your everyday wear.Join the Sustainable Fashion Movement Order your unique Goodfair flannel today. Remember, each piece is one-of-a-kind, with our signature logo adding a special touch to your sustainable fashion choice.Discover Your Mystery Flannel Now!","Goodfair"
"Retro Knit Sweaters: Set of 2","https://goodfair.com/products.json","40.00","https://cdn.shopify.com/s/files/1/0077/1745/3881/files/IMG_2000.jpg?v=1700251459","Embrace the cozy charm of winter with Goodfair's collection of thrifted sweaters! Each piece in our curated selection tells a unique story, blending comfort with classic style. From chunky knits to soft, delicate weaves, our sweaters are hand-picked for quality and character. Perfect for chilly days, they offer not just warmth but a sustainable fashion choice, reducing your carbon footprint one stylish layer at a time. Shop with us and find your one-of-a-kind winter essential, knowing that you're making an eco-friendly choice that's as kind to the planet as it is to your wardrobe","Goodfair"
"Champion Mens Shorts X Large Red Lightweight Outdoors Pull On","https://goodfair.com/products.json","20.00","https://cdn.shopify.com/s/files/1/0077/1745/3881/products/b2bbb419-4904-4f94-99dd-08f0a33dadce.jpg?v=1695321465","Champion Mens Shorts X Large Red Lightweight Outdoors Pull OnBrand: ChampionType: ShortsCondition: Good - shows sign of wearSize: XLColor/Pattern: RED-Length: 16 Inches\n-Inseam: 4 Inches\n-Leg Opening: 15.5 Inches\n-Waist: 35 Inches","eCommerce"
"OP Shorts Mens 46 Green Khaki Camouflage Cargo Shorts Casual Outdoors Hiking","https://goodfair.com/products.json","14.99","https://cdn.shopify.com/s/files/1/0077/1745/3881/products/0efffec0-b211-4786-b66d-48e1fd5c603d.jpg?v=1695320517","OP Shorts Mens 46 Green Khaki Camouflage Cargo Shorts Casual Outdoors HikingBrand: OPType: ShortsCondition: Good - shows sign of wearSize: 46Color/Pattern: Green KhakiMaterial: Polyester BlendMeasurement:Length: 22.5 Inches.\nInseam: 12 Inches.\nLeg Opening: 13 Inches. \nWaist: 45 Inches.","eCommerce"
"American Eagle Womens Cardigan Sweater Front Button Green White Size Medium","https://goodfair.com/products.json","12.99","https://cdn.shopify.com/s/files/1/0077/1745/3881/products/57_653b5529-2b50-44a0-b780-96c297f04e1d.jpg?v=1694498795","American Eagle Womens Cardigan Sweater Front Button Green White Size Medium\nGood Used Condition and Please See the Pictures for Measurement and Condition. \nProduct Descriptions:\n- Brand: American Eagle- Color: Green White- Size:  Medium- Style: Cardigan Sweater \nMeasurement:\nWaist: 27 Inches Length: 26 InchesSleeve Length: 23.75 Inches\nNOTE: For best fit, please refer to the measurements in our photos instead of the size tag on the garment. We also ask you to inspect the photos for stains, rips tears and imperfections. We do our best to provide a great experience and offer 60 day free returns in case you don't like it for any reason.If there are any problems with your order, please contact us before leaving negative or neutral feedback.All items come from a smoke and odor free Thrift Store.We work very hard to ensure your satisfaction. Thanks for shopping with Goodfair.","American Eagle Outfitters"
"Abercrombie & Fitch Women Cardigan Sweater Knitted Long Sleeves Gray Size Small","https://goodfair.com/products.json","12.99","https://cdn.shopify.com/s/files/1/0077/1745/3881/products/57_e912d688-9835-4996-8cf2-d96c0e5bcf06.jpg?v=1694498777","Abercrombie & Fitch Women Cardigan Sweater Knitted Long Sleeves Gray Size Small\nGood used condition. Please see the pictures for measurement and condition.\nProduct Descriptions: \n- Brand: Abercrombie & Fitch- Color:  Gray - Size: Small- Style: Cardigan Sweater\nMeasurement: \nPit to Pit: 15 Inches Length: 28 InchesSleeve Length: 23 Inches  \nNOTE: For best fit, please refer to the measurements in our photos instead of the size tag on the garment. We also ask you to inspect the photos for stains, rips tears and imperfections. We do our best to provide a great experience and offer 60 day free returns in case you don't like it for any reason.If there are any problems with your order, please contact us before leaving negative or neutral feedback.All items come from a smoke and odor free Thrift Store.We work very hard to ensure your satisfaction. Thanks for shopping with Goodfair.\n","Abercrombie & Fitch"
"Abercrombie & Fitch Women Pullover Sweater Knitted Long Sleeves Black SZ X Small","https://goodfair.com/products.json","12.99","https://cdn.shopify.com/s/files/1/0077/1745/3881/products/57_1b57bc2d-5441-4b98-92eb-d9c2379b2dd5.jpg?v=1694498763","Abercrombie & Fitch Women Pullover Sweater Knitted Long Sleeves Black SZ X Small\n Good used condition please see the pictures for measurement and condition.\nProduct Descriptions: \n- Brand: Abercrombie &Fitch - Color: Black - Size:  X Small- Style: Pullover Sweater \nMeasurements:\nWaist: 26 Inches Length: 25.5 Inches Sleeve Length: 24.5 Inches \nNOTE: For best fit, please refer to the measurements in our photos instead of the size tag on the garment. We also ask you to inspect the photos for stains, rips tears and imperfections. We do our best to provide a great experience and offer 60 day free returns in case you don't like it for any reason. If there are any problems with your order, please contact us before leaving negative or neutral feedback. We work very hard to ensure your satisfaction. Thanks for shopping with Goodfair.","Abercrombie & Fitch"
"Aeropostale Womens Pullover Sweater Long Sleeves Front Knot Maroon Size X Large","https://goodfair.com/products.json","12.99","https://cdn.shopify.com/s/files/1/0077/1745/3881/products/57_16d3637a-bbaa-43fe-820a-a89a9a06434c.jpg?v=1694498745","Aeropostale Womens Pullover Sweater Long Sleeves Front Knot Maroon Size X Large\nGood Used Condition and Please See the Pictures for Measurement and Condition. \nProduct Descriptions:\n- Brand: Aeropostale - Color: Maroon - Size:  X Large- Style: Pullover Sweater \nMeasurement:\nWaist: 23.5 Inches Length: 24 InchesSleeve Length: 24 Inches\nNOTE: For best fit, please refer to the measurements in our photos instead of the size tag on the garment. We also ask you to inspect the photos for stains, rips tears and imperfections. We do our best to provide a great experience and offer 60 day free returns in case you don't like it for any reason.If there are any problems with your order, please contact us before leaving negative or neutral feedback.All items come from a smoke and odor free Thrift Store.We work very hard to ensure your satisfaction. Thanks for shopping with Goodfair.","Aéropostale"
"Express Womens Pullover Hooded Sweater Long Sleeve Cotton Navy Blue Size Medium","https://goodfair.com/products.json","12.99","https://cdn.shopify.com/s/files/1/0077/1745/3881/products/57_490d4669-6a92-4d3c-9cd6-36c59f5bfe09.jpg?v=1694498729","Express Womens Pullover Hooded Sweater Long Sleeve Cotton Navy Blue Size Medium\n Good, Used Condition. Please See the Pictures for Measurement and Condition.\n Product Descriptions:\nBrande: ExpressStyle: Pullover Sweater Size: MediumColor: Navy Blue \nMeasurement:\n-Pit to Pit: 17 Inches -Length: 23 Inches-Sleeve Length: 23.5 Inches  \nNOTE: For best fit, please refer to the measurements in our photos instead of the size tag on the garment. We also ask you to inspect the photos for stains, rips tears and imperfections. We do our best to provide a great experience and offer 60 day free returns in case you don't like it for any reason.If there are any problems with your order, please contact us before leaving negative or neutral feedback.All items come from a smoke and odor free Thrift Store.We work very hard to ensure your satisfaction. Thanks for shopping with Goodfair.\n","Express"
"Aeropostale Womens Cardigan Sweater Hooded Long Sleeve Black White Size X Large","https://goodfair.com/products.json","12.99","https://cdn.shopify.com/s/files/1/0077/1745/3881/products/57_c49d3239-dfe9-4861-99f4-b6bda73b17fc.jpg?v=1694498714","Aeropostale Womens Cardigan Sweater Hooded Long Sleeve Black White Size X Large\nGOOD, USED CONDITION. Please See the Pictures for Measurement and Condition. \"\n- Product Features:\n- Brand Name: Aeropostale- Color: Black- Size: X Large- Style: Cardigan\n- Measurement:\n-Length:28 Inches -Pit to pit:17 Inches -Sleeve Length:23 Inches \nNOTE: For best fit, please refer to the measurements in our photos instead of the size tag on the garment. We also ask you to inspect the photos for stains, rips tears and imperfections. We do our best to provide a great experience and offer 60 day free returns in case you don't like it for any reason.If there are any problems with your order, please contact us before leaving negative or neutral feedback.All items come from a smoke and odor free Thrift Store.We work very hard to ensure your satisfaction. Thanks for shopping with Goodfair.","Aéropostale"
"Banana Republic Womens Full Zip Up Sweater Long Sleeves Black Size Large","https://goodfair.com/products.json","12.99","https://cdn.shopify.com/s/files/1/0077/1745/3881/products/57_d1fa71da-615a-46bd-8e72-0f9f3fe830ea.jpg?v=1694498688","Banana Republic Womens Full Zip Up Sweater Long Sleeves Black Size Large\nGood Used Condition and Please See the Pictures for Measurement and Condition. \nProduct Descriptions:\n- Brand: Banana Republic- Color: Black - Size:  Large- Style: Full Zip Up Sweater \nMeasurement:\nWaist: 28 Inches Length: 20 InchesSleeve Length: 17.25 Inches\nNOTE: For best fit, please refer to the measurements in our photos instead of the size tag on the garment. We also ask you to inspect the photos for stains, rips tears and imperfections. We do our best to provide a great experience and offer 60 day free returns in case you don't like it for any reason.If there are any problems with your order, please contact us before leaving negative or neutral feedback.All items come from a smoke and odor free Thrift Store.We work very hard to ensure your satisfaction. Thanks for shopping with Goodfair.","Banana Republic"
"Banana Republic Womens Cardigan Knitted Sweater Front Button Beige Size Medium","https://goodfair.com/products.json","12.99","https://cdn.shopify.com/s/files/1/0077/1745/3881/products/57_8900ec6a-d9e9-4a4a-9f0f-be9f119c368e.jpg?v=1694498672","Banana Republic Womens Cardigan Knitted Sweater Front Button Beige Size Medium\n \"Good, Used Condition. Please See the Pictures for Measurement and Condition.\nProduct Descriptions: \n- Brand: Banana Republic - Color: Beige - Size: Medium- Style:  Cardigan Sweater\nMeasurement: \nPit to Pit: 19 Inches Length: 32 InchesSleeve Length: 22 Inches  \nNOTE: For best fit, please refer to the measurements in our photos instead of the size tag on the garment. We also ask you to inspect the photos for stains, rips tears and imperfections. We do our best to provide a great experience and offer 60 day free returns in case you don't like it for any reason.If there are any problems with your order, please contact us before leaving negative or neutral feedback.All items come from a smoke and odor free Thrift Store.We work very hard to ensure your satisfaction. Thanks for shopping with Goodfair.\n","Banana Republic"
"Express Womens Pullover  Sweater Long Sleeve V Neck Cotton Maroon Size Large","https://goodfair.com/products.json","12.99","https://cdn.shopify.com/s/files/1/0077/1745/3881/products/57_05b72486-55b1-48b0-8b57-d6c341070b2e.jpg?v=1694498656","Express Womens Pullover  Sweater Long Sleeve V Neck Cotton Maroon Size Large\n Good, Used Condition. Please See the Pictures for Measurement and Condition.\n Product Descriptions:\nBrande: ExpressStyle: Pullover Sweater Size: LargeColor: Maroon \nMeasurement:\nPit to Pit: 17 Inches Length: 27.5 InchesSleeve Length: 24.5 Inches  \nNOTE: For best fit, please refer to the measurements in our photos instead of the size tag on the garment. We also ask you to inspect the photos for stains, rips tears and imperfections. We do our best to provide a great experience and offer 60 day free returns in case you don't like it for any reason.If there are any problems with your order, please contact us before leaving negative or neutral feedback.All items come from a smoke and odor free Thrift Store.We work very hard to ensure your satisfaction. Thanks for shopping with Goodfair.\n","Express"
"Express Womens Pullover Sweater Knitted Round Neck Long Sleeve Black Size Medium","https://goodfair.com/products.json","12.99","https://cdn.shopify.com/s/files/1/0077/1745/3881/products/57_23f36950-d3de-43e3-a62a-5fe9c4f1f94e.jpg?v=1694498642","Express Womens Pullover Sweater Knitted Round Neck Long Sleeve Black Size Medium\nGood Used Condition and Please See the Pictures for Measurement and Condition. \nProduct Descriptions:\n- Brand: Express - Color: Black  - Size:  Medium- Style: Pullover Sweater \nMeasurement:\nWaist: 35 Inches Length: 25.5 InchesSleeve Length: 23.75 Inches\nNOTE: For best fit, please refer to the measurements in our photos instead of the size tag on the garment. We also ask you to inspect the photos for stains, rips tears and imperfections. We do our best to provide a great experience and offer 60 day free returns in case you don't like it for any reason.If there are any problems with your order, please contact us before leaving negative or neutral feedback.All items come from a smoke and odor free Thrift Store.We work very hard to ensure your satisfaction. Thanks for shopping with Goodfair.","Express"
"ST Johns Bay Womens Pullover Sweater Knitted Long Sleeves Blue White Size Small","https://goodfair.com/products.json","12.99","https://cdn.shopify.com/s/files/1/0077/1745/3881/products/57_4fb14a80-6914-4e6a-9163-65a944f6442f.jpg?v=1694498624","ST Johns Bay Womens Pullover Sweater Knitted Long Sleeves Blue White Size Small\nGood, Used Condition. Please See the Pictures for Measurement and Condition. \"\nProduct Descriptions: \nBRAND: ST Johns Bay\nStyle: Pullover SweaterColor: Blue WhiteSize: Small\n- Measurement:\nWaist: 37 Inches Length: 24 Inches Sleeve Length: 22 Inches \nNOTE: For best fit, please refer to the measurements in our photos instead of the size tag on the garment. We also ask you to inspect the photos for stains, rips tears and imperfections. We do our best to provide a great experience and offer 60 day free returns in case you don't like it for any reason. If there are any problems with your order, please contact us before leaving negative or neutral feedback. We work very hard to ensure your satisfaction. Thanks for shopping with Goodfair.\n","St. John's Bay"
"Ann Taylor Womens Cardigan Sweater Front Button Long Sleeves Black Size Medium","https://goodfair.com/products.json","12.99","https://cdn.shopify.com/s/files/1/0077/1745/3881/products/57_ab1d7e1b-af94-491f-b8a2-9892edf6ae0d.jpg?v=1694498605","Ann Taylor Womens Cardigan Sweater Front Button Long Sleeves Black Size Medium\nCondition: \"Good, Used Condition. Please See the Pictures for Measurement and Condition.\nProduct Description:\n- Brand: Ann Taylor   - Color: Black - Size: Medium- Style: Cardigan Sweater \nMeasurements:\nPit to Pit: 17.5 Inches Length: 20.5 InchesSleeve Length: 19 Inches  \nNOTE: For best fit, please refer to the measurements in our photos instead of the size tag on the garment. We also ask you to inspect the photos for stains, rips tears and imperfections. We do our best to provide a great experience and offer 60 day free returns in case you don't like it for any reason.If there are any problems with your order, please contact us before leaving negative or neutral feedback.All items come from a smoke and odor free Thrift Store.We work very hard to ensure your satisfaction. Thanks for shopping with Goodfair.\n","Ann Taylor"
"The Limited Women Pullover Sweater Knitted Crew Neck Long Sleeves Pink SZ Medium","https://goodfair.com/products.json","12.99","https://cdn.shopify.com/s/files/1/0077/1745/3881/products/57_1065e705-1434-4691-b751-541b41c169ec.jpg?v=1694498590","The Limited Women Pullover Sweater Knitted Crew Neck Long Sleeves Pink SZ Medium\n Good used condition please see the pictures for measurement and condition. \nProduct Descriptions: \n- Brand: The Limited- Color: Pink - Size:  Medium- Style: Pullover Sweater \nMeasurements:\nWaist: 36 Inches \nLength: 24 Inches \nSleeve Length: 15.5 Inches \nNOTE: For best fit, please refer to the measurements in our photos instead of the size tag on the garment. We also ask you to inspect the photos for stains, rips tears and imperfections. We do our best to provide a great experience and offer 60 day free returns in case you don't like it for any reason. If there are any problems with your order, please contact us before leaving negative or neutral feedback. We work very hard to ensure your satisfaction. Thanks for shopping with Goodfair.","The Limited"
"Banana Republic Womens Sweater Cardigan Front Button Leopard Print Beige Size M","https://goodfair.com/products.json","12.99","https://cdn.shopify.com/s/files/1/0077/1745/3881/products/57_bb1e1ca1-0ac2-4c9e-920c-359cbb2360ac.jpg?v=1694498574","Banana Republic Womens Sweater Cardigan Front Button Leopard Print Beige Size M\nGood Used Condition and Please See the Pictures for Measurement and Condition. \n Product Descriptions:\nBrand: Banana RepublicStyle: Cardigan SweaterSize: MediumColor: Beige \nMeasurement:\n-Waist: 25 Inches-Length: 17 Inches.-Sleeve Length: 25 Inches\n\n NOTE: For best fit, please refer to the measurements in our photos instead of the size tag on the garment. We also ask you to inspect the photos for stains, rips tears and imperfections. We do our best to provide a great experience and offer 60 day free returns in case you don't like it for any reason.\nIf there are any problems with your order, please contact us before leaving negative or neutral feedback.All items come from a smoke and odor free Thrift Store.We work very hard to ensure your satisfaction. Thanks for shopping with Goodfair.","Banana Republic"
"Forever 21 Womens Cardigan Sweater Front Button Long Sleeves Black Size Medium","https://goodfair.com/products.json","12.99","https://cdn.shopify.com/s/files/1/0077/1745/3881/products/57_c523d082-7f79-4674-aaa1-087c9c6ffa6d.jpg?v=1694498556","Forever 21 Womens Cardigan Sweater Front Button Long Sleeves Black Size Medium\nGOOD, USED CONDITION. Please See the Pictures for Measurement and Condition. \"\n- Product Features:\n- Brand Name: Forever 21- Color: Black - Size: Medium- Style: Cardigan Sweater \n- Measurement:\nPit to Pit: 21.5 Inches Length: 27.5 InchesSleeve Length: 21.5 Inches  \nNOTE: For best fit, please refer to the measurements in our photos instead of the size tag on the garment. We also ask you to inspect the photos for stains, rips tears and imperfections. We do our best to provide a great experience and offer 60 day free returns in case you don't like it for any reason.If there are any problems with your order, please contact us before leaving negative or neutral feedback.All items come from a smoke and odor free Thrift Store.We work very hard to ensure your satisfaction. Thanks for shopping with Goodfair.\n","FOREVER 21"
"Forever 21 Women Pullover Sweater Knitted Long Sleeve Round Neck Light Pink SZ S","https://goodfair.com/products.json","12.99","https://cdn.shopify.com/s/files/1/0077/1745/3881/products/57_34087405-7326-4ac5-a0ab-08af36fef087.jpg?v=1694498543","Forever 21 Women Pullover Sweater Knitted Long Sleeve Round Neck Light Pink SZ S\nGood Used Condition and Please See the Pictures for Measurement and Condition.\n Product Descriptions:\nBrande: Forever 21Style: Pullover  Sweater Size: SmallColor: Nude Pink\nMeasurement:\n\n-Pit to Pit: 17.5 Inches -Length: 24.5 Inches-Sleeve Length: 22 Inches  \nNOTE: For best fit, please refer to the measurements in our photos instead of the size tag on the garment. We also ask you to inspect the photos for stains, rips tears and imperfections. We do our best to provide a great experience and offer 60 day free returns in case you don't like it for any reason.If there are any problems with your order, please contact us before leaving negative or neutral feedback.All items come from a smoke and odor free Thrift Store.We work very hard to ensure your satisfaction. Thanks for shopping with Goodfair.\n","FOREVER 21"
"Forever 21 Women Pullover Sweater Knitted Long Sleeve Mock Neck Brown Size Small","https://goodfair.com/products.json","12.99","https://cdn.shopify.com/s/files/1/0077/1745/3881/products/57_42f36318-da7e-41ca-a5f4-cab5e5cf76c0.jpg?v=1694498527","Forever 21 Women Pullover Sweater Knitted Long Sleeve Mock Neck Brown Size Small\n Good used condition please see the pictures for measurement and condition. \"\nProduct Descriptions:\nBrand Name: Forever 21.Style: Pullover Sweater Size: SmallColor: Brown \nMeasurement:\nWaist: 46 Inches Length: 21 Inches Sleeve Length: 17 Inches \nNOTE: For best fit, please refer to the measurements in our photos instead of the size tag on the garment. We also ask you to inspect the photos for stains, rips tears and imperfections. We do our best to provide a great experience and offer 60 day free returns in case you don't like it for any reason. If there are any problems with your order, please contact us before leaving negative or neutral feedback. We work very hard to ensure your satisfaction. Thanks for shopping with Goodfair.","FOREVER 21"
"Express Women Cardigan Knitted Sweater Long Sleeve Front Button Beige Size Small","https://goodfair.com/products.json","12.99","https://cdn.shopify.com/s/files/1/0077/1745/3881/products/57_88b61f75-c73f-49ce-9517-d9643a7c84d3.jpg?v=1694498508","Express Women Cardigan Knitted Sweater Long Sleeve Front Button Beige Size Small\nGood Used Condition and Please See the Pictures for Measurement and Condition.\nProduct Descriptions: \nBrand: Express Style: Cardigan Sweater Size: SmallColor: Beige \nMeasurement:\nPit to Pit: 18.5 Inches Length: 19.5 InchesSleeve Length: 21 Inches  \nNOTE: For best fit, please refer to the measurements in our photos instead of the size tag on the garment. We also ask you to inspect the photos for stains, rips tears and imperfections. We do our best to provide a great experience and offer 60 day free returns in case you don't like it for any reason.If there are any problems with your order, please contact us before leaving negative or neutral feedback.All items come from a smoke and odor free Thrift Store.We work very hard to ensure your satisfaction. Thanks for shopping with Goodfair.\n","Express"
